{"action": "like", "job": {"岗位名称": "Java初级开发工程师", "企业": "蓝图信息有限公司", "岗位薪资": "12-27Kx13薪", "岗位要求": "0-1年大专 211优先", "岗位职责": "参与系统设计与核心模块开发，使用SpringBoot, MySQL, TensorFlow, Go, Kubernetes, Kafka, React, JVM； 编写接口与技术文档，保证代码质量与稳定性； 优化性能与可靠性，参与上线与故障排查； 协作跨团队沟通，推进项目按期交付", "岗位地址": "北京东城区中心大道国际中心C座6层", "二级分类": "后端开发", "三级分类": "Java", "城市": "北京"}, "resume": {"personal_info": {"current_city": "深圳", "willingness_to_relocate": true, "availability_date": "2024-08-01"}, "work_preferences": {"position_type_name": ["Java", "全栈工程师"], "salary_expectation": {"min_annual_package": 300000, "currency": "CNY"}}, "professional_summary": {"total_experience_years": 3.5, "education_level": "本科", "school_level": 0}, "full_resume_text": "张伟 | 求职意向: Java后端开发、全栈    基本信息:    - 现居地: 深圳市南山区    - 联系电话: 138-0013-8000    - 邮箱: zhangwei.dev@email.com    - 学历: 本科 (2017-2021)    - 工作经验: 3.5年    - 入职时间: 我目前在职，最早可以在2024年8月1号入职。    - 职业期望: 期望在电子商务或人工智能行业发展。对上海的工作机会也持开放态度。    - 期望薪资: 我的期望是年薪不低于30万人民币。    专业技能:    - 精通 Java 和golang语言，熟悉 JVM 原理和多线程编程。    - 熟练掌握 Spring Boot, Spring Cloud, MyBatis等主流微服务框架。    - 熟悉 MySQL, Redis, Kafka，并有相关的性能优化经验。    - 了解 Python 和 Go 语言，能够编写简单的脚本。    - 熟悉 Docker, Kubernetes 等容器化技术。    工作经历:    [...此处省略详细的工作经历描述...]"}}
{"action": "skip", "job": {"岗位名称": "Java初级开发工程师", "企业": "蓝图信息有限公司", "岗位薪资": "12-27Kx13薪", "岗位要求": "0-1年大专 211优先", "岗位职责": "参与系统设计与核心模块开发，使用SpringBoot, MySQL, TensorFlow, Go, Kubernetes, Kafka, React, JVM； 编写接口与技术文档，保证代码质量与稳定性； 优化性能与可靠性，参与上线与故障排查； 协作跨团队沟通，推进项目按期交付", "岗位地址": "北京东城区中心大道国际中心C座6层", "二级分类": "后端开发", "三级分类": "Java", "城市": "北京"}, "resume": {"personal_info": {"current_city": "深圳", "willingness_to_relocate": true, "availability_date": "2024-08-01"}, "work_preferences": {"position_type_name": ["Java", "全栈工程师"], "salary_expectation": {"min_annual_package": 300000, "currency": "CNY"}}, "professional_summary": {"total_experience_years": 3.5, "education_level": "本科", "school_level": 0}, "full_resume_text": "张伟 | 求职意向: Java后端开发、全栈    基本信息:    - 现居地: 深圳市南山区    - 联系电话: 138-0013-8000    - 邮箱: zhangwei.dev@email.com    - 学历: 本科 (2017-2021)    - 工作经验: 3.5年    - 入职时间: 我目前在职，最早可以在2024年8月1号入职。    - 职业期望: 期望在电子商务或人工智能行业发展。对上海的工作机会也持开放态度。    - 期望薪资: 我的期望是年薪不低于30万人民币。    专业技能:    - 精通 Java 和golang语言，熟悉 JVM 原理和多线程编程。    - 熟练掌握 Spring Boot, Spring Cloud, MyBatis等主流微服务框架。    - 熟悉 MySQL, Redis, Kafka，并有相关的性能优化经验。    - 了解 Python 和 Go 语言，能够编写简单的脚本。    - 熟悉 Docker, Kubernetes 等容器化技术。    工作经历:    [...此处省略详细的工作经历描述...]"}}
{"action": "like", "job": {"岗位名称": "Java中级开发工程师", "企业": "博睿系统有限公司", "岗位薪资": "28-35K·12薪", "岗位要求": "0-1年大专", "岗位职责": "参与系统设计与核心模块开发，使用Node.js, JVM, Java, Docker, SpringBoot, TensorFlow, Kafka, Kubernetes； 编写接口与技术文档，保证代码质量与稳定性； 优化性能与可靠性，参与上线与故障排查； 协作跨团队沟通，推进项目按期交付", "岗位地址": "深圳南山区创新路科创大厦E座15层", "二级分类": "后端开发", "三级分类": "Java", "城市": "深圳"}, "resume": {"personal_info": {"current_city": "上海", "willingness_to_relocate": true, "availability_date": "2024-08-01", "phone": "138-0013-8000", "email": "zhangwei.dev@email.com"}, "work_preferences": {"position_type_name": ["Java", "全栈工程师"], "salary_expectation": {"min_annual_package": 300000, "currency": "CNY"}, "industry_preferences": ["电子商务", "人工智能"]}, "professional_summary": {"total_experience_years": 3.5, "education_level": "本科", "school_level": 0, "graduation_year": 2021}, "full_resume_text": "张伟 | 求职意向: Java后端开发、全栈    基本信息:    - 现居地: 深圳市南山区    - 联系电话: 138-0013-8000    - 邮箱: zhangwei.dev@email.com    - 学历: 本科 (2017-2021)    - 工作经验: 3.5年    - 入职时间: 我目前在职，最早可以在2024年8月1号入职。    - 职业期望: 期望在电子商务或人工智能行业发展。对上海的工作机会也持开放态度。    - 期望薪资: 我的期望是年薪不低于30万人民币。    专业技能:    - 精通 Java 和golang语言，熟悉 JVM 原理和多线程编程。    - 熟练掌握 Spring Boot, Spring Cloud, MyBatis等主流微服务框架。    - 熟悉 MySQL, Redis, Kafka，并有相关的性能优化经验。    - 了解 Python 和 Go 语言，能够编写简单的脚本。    - 熟悉 Docker, Kubernetes 等容器化技术。    工作经历:    \"Java后端\": {        \"companies\": [\"阿里巴巴\", \"京东\", \"美团\", \"滴滴\", \"百度\"],        \"skills\": [\"Java\", \"SpringBoot\", \"SpringCloud\", \"MyBatis\", \"MySQL\", \"Redis\", \"Kafka\", \"微服务\", \"分布式系统\"],        \"responsibilities\": [            \"负责后端服务的设计和开发\",            \"使用SpringBoot构建微服务架构\",            \"参与系统性能优化和容量规划\",            \"处理高并发场景下的技术问题\",            \"编写技术文档和Code Review\"        ]    }", "skills": ["Java", "Golang", "JVM", "多线程编程", "Spring Boot", "Spring Cloud", "MyBatis", "MySQL", "Redis", "Kafka", "Python", "Go", "Docker", "Kubernetes", "微服务", "分布式系统"], "work_experience": {"companies": ["阿里巴巴", "京东", "美团", "滴滴", "百度"], "responsibilities": ["负责后端服务的设计和开发", "使用SpringBoot构建微服务架构", "参与系统性能优化和容量规划", "处理高并发场景下的技术问题", "编写技术文档和Code Review"]}}}
{"action": "skip", "job": {"岗位名称": "Java初级开发工程师", "企业": "极光智能有限公司", "岗位薪资": "28-43Kx13薪", "岗位要求": "0-1年本科", "岗位职责": "参与系统设计与核心模块开发，使用Redis, Java, SpringBoot, 多线程, Docker, Vue； 编写接口与技术文档，保证代码质量与稳定性； 优化性能与可靠性，参与上线与故障排查； 协作跨团队沟通，推进项目按期交付", "岗位地址": "南京鼓楼区云谷路产业园A座C座6层", "二级分类": "后端开发", "三级分类": "Java", "城市": "南京"}, "resume": {"personal_info": {"current_city": "上海", "willingness_to_relocate": true, "availability_date": "2024-08-01", "phone": "138-0013-8000", "email": "zhangwei.dev@email.com"}, "work_preferences": {"position_type_name": ["Java", "全栈工程师"], "salary_expectation": {"min_annual_package": 300000, "currency": "CNY"}, "industry_preferences": ["电子商务", "人工智能"]}, "professional_summary": {"total_experience_years": 3.5, "education_level": "本科", "school_level": 0, "graduation_year": 2021}, "full_resume_text": "张伟 | 求职意向: Java后端开发、全栈    基本信息:    - 现居地: 深圳市南山区    - 联系电话: 138-0013-8000    - 邮箱: zhangwei.dev@email.com    - 学历: 本科 (2017-2021)    - 工作经验: 3.5年    - 入职时间: 我目前在职，最早可以在2024年8月1号入职。    - 职业期望: 期望在电子商务或人工智能行业发展。对上海的工作机会也持开放态度。    - 期望薪资: 我的期望是年薪不低于30万人民币。    专业技能:    - 精通 Java 和golang语言，熟悉 JVM 原理和多线程编程。    - 熟练掌握 Spring Boot, Spring Cloud, MyBatis等主流微服务框架。    - 熟悉 MySQL, Redis, Kafka，并有相关的性能优化经验。    - 了解 Python 和 Go 语言，能够编写简单的脚本。    - 熟悉 Docker, Kubernetes 等容器化技术。    工作经历:    \"Java后端\": {        \"companies\": [\"阿里巴巴\", \"京东\", \"美团\", \"滴滴\", \"百度\"],        \"skills\": [\"Java\", \"SpringBoot\", \"SpringCloud\", \"MyBatis\", \"MySQL\", \"Redis\", \"Kafka\", \"微服务\", \"分布式系统\"],        \"responsibilities\": [            \"负责后端服务的设计和开发\",            \"使用SpringBoot构建微服务架构\",            \"参与系统性能优化和容量规划\",            \"处理高并发场景下的技术问题\",            \"编写技术文档和Code Review\"        ]    }", "skills": ["Java", "Golang", "JVM", "多线程编程", "Spring Boot", "Spring Cloud", "MyBatis", "MySQL", "Redis", "Kafka", "Python", "Go", "Docker", "Kubernetes", "微服务", "分布式系统"], "work_experience": {"companies": ["阿里巴巴", "京东", "美团", "滴滴", "百度"], "responsibilities": ["负责后端服务的设计和开发", "使用SpringBoot构建微服务架构", "参与系统性能优化和容量规划", "处理高并发场景下的技术问题", "编写技术文档和Code Review"]}}}
{"action": "skip", "job": {"岗位名称": "Java资深开发工程师", "企业": "光瀚网络股份有限公司", "岗位薪资": "15-27Kx13薪", "岗位要求": "1-3年大专 211优先", "岗位职责": "参与系统设计与核心模块开发，使用Docker, Kafka, Java, MySQL, SpringCloud, Redis； 编写接口与技术文档，保证代码质量与稳定性； 优化性能与可靠性，参与上线与故障排查； 协作跨团队沟通，推进项目按期交付", "岗位地址": "北京朝阳区星河路云计算中心E座15层", "二级分类": "后端开发", "三级分类": "Java", "城市": "北京"}, "resume": {"personal_info": {"current_city": "上海", "willingness_to_relocate": true, "availability_date": "2024-08-01", "phone": "138-0013-8000", "email": "zhangwei.dev@email.com"}, "work_preferences": {"position_type_name": ["Java", "全栈工程师"], "salary_expectation": {"min_annual_package": 300000, "currency": "CNY"}, "industry_preferences": ["电子商务", "人工智能"]}, "professional_summary": {"total_experience_years": 3.5, "education_level": "本科", "school_level": 0, "graduation_year": 2021}, "full_resume_text": "张伟 | 求职意向: Java后端开发、全栈    基本信息:    - 现居地: 深圳市南山区    - 联系电话: 138-0013-8000    - 邮箱: zhangwei.dev@email.com    - 学历: 本科 (2017-2021)    - 工作经验: 3.5年    - 入职时间: 我目前在职，最早可以在2024年8月1号入职。    - 职业期望: 期望在电子商务或人工智能行业发展。对上海的工作机会也持开放态度。    - 期望薪资: 我的期望是年薪不低于30万人民币。    专业技能:    - 精通 Java 和golang语言，熟悉 JVM 原理和多线程编程。    - 熟练掌握 Spring Boot, Spring Cloud, MyBatis等主流微服务框架。    - 熟悉 MySQL, Redis, Kafka，并有相关的性能优化经验。    - 了解 Python 和 Go 语言，能够编写简单的脚本。    - 熟悉 Docker, Kubernetes 等容器化技术。    工作经历:    \"Java后端\": {        \"companies\": [\"阿里巴巴\", \"京东\", \"美团\", \"滴滴\", \"百度\"],        \"skills\": [\"Java\", \"SpringBoot\", \"SpringCloud\", \"MyBatis\", \"MySQL\", \"Redis\", \"Kafka\", \"微服务\", \"分布式系统\"],        \"responsibilities\": [            \"负责后端服务的设计和开发\",            \"使用SpringBoot构建微服务架构\",            \"参与系统性能优化和容量规划\",            \"处理高并发场景下的技术问题\",            \"编写技术文档和Code Review\"        ]    }", "skills": ["Java", "Golang", "JVM", "多线程编程", "Spring Boot", "Spring Cloud", "MyBatis", "MySQL", "Redis", "Kafka", "Python", "Go", "Docker", "Kubernetes", "微服务", "分布式系统"], "work_experience": {"companies": ["阿里巴巴", "京东", "美团", "滴滴", "百度"], "responsibilities": ["负责后端服务的设计和开发", "使用SpringBoot构建微服务架构", "参与系统性能优化和容量规划", "处理高并发场景下的技术问题", "编写技术文档和Code Review"]}}}
{"action": "skip", "job": {"岗位名称": "Java架构师开发工程师", "企业": "凌云网络有限公司", "岗位薪资": "18-26K·12薪", "岗位要求": "0-1年本科 985优先", "岗位职责": "参与系统设计与核心模块开发，使用SpringBoot, Vue, MySQL, Java, Kubernetes, Redis； 编写接口与技术文档，保证代码质量与稳定性； 优化性能与可靠性，参与上线与故障排查； 协作跨团队沟通，推进项目按期交付", "岗位地址": "北京朝阳区软件园路云计算中心A座8层", "二级分类": "后端开发", "三级分类": "Java", "城市": "北京"}, "resume": {"personal_info": {"current_city": "上海", "willingness_to_relocate": true, "availability_date": "2024-08-01", "phone": "138-0013-8000", "email": "zhangwei.dev@email.com"}, "work_preferences": {"position_type_name": ["Java", "全栈工程师"], "salary_expectation": {"min_annual_package": 300000, "currency": "CNY"}, "industry_preferences": ["电子商务", "人工智能"]}, "professional_summary": {"total_experience_years": 3.5, "education_level": "本科", "school_level": 0, "graduation_year": 2021}, "full_resume_text": "张伟 | 求职意向: Java后端开发、全栈    基本信息:    - 现居地: 深圳市南山区    - 联系电话: 138-0013-8000    - 邮箱: zhangwei.dev@email.com    - 学历: 本科 (2017-2021)    - 工作经验: 3.5年    - 入职时间: 我目前在职，最早可以在2024年8月1号入职。    - 职业期望: 期望在电子商务或人工智能行业发展。对上海的工作机会也持开放态度。    - 期望薪资: 我的期望是年薪不低于30万人民币。    专业技能:    - 精通 Java 和golang语言，熟悉 JVM 原理和多线程编程。    - 熟练掌握 Spring Boot, Spring Cloud, MyBatis等主流微服务框架。    - 熟悉 MySQL, Redis, Kafka，并有相关的性能优化经验。    - 了解 Python 和 Go 语言，能够编写简单的脚本。    - 熟悉 Docker, Kubernetes 等容器化技术。    工作经历:    \"Java后端\": {        \"companies\": [\"阿里巴巴\", \"京东\", \"美团\", \"滴滴\", \"百度\"],        \"skills\": [\"Java\", \"SpringBoot\", \"SpringCloud\", \"MyBatis\", \"MySQL\", \"Redis\", \"Kafka\", \"微服务\", \"分布式系统\"],        \"responsibilities\": [            \"负责后端服务的设计和开发\",            \"使用SpringBoot构建微服务架构\",            \"参与系统性能优化和容量规划\",            \"处理高并发场景下的技术问题\",            \"编写技术文档和Code Review\"        ]    }", "skills": ["Java", "Golang", "JVM", "多线程编程", "Spring Boot", "Spring Cloud", "MyBatis", "MySQL", "Redis", "Kafka", "Python", "Go", "Docker", "Kubernetes", "微服务", "分布式系统"], "work_experience": {"companies": ["阿里巴巴", "京东", "美团", "滴滴", "百度"], "responsibilities": ["负责后端服务的设计和开发", "使用SpringBoot构建微服务架构", "参与系统性能优化和容量规划", "处理高并发场景下的技术问题", "编写技术文档和Code Review"]}}}
{"action": "skip", "job": {"岗位名称": "Java初级开发工程师", "企业": "蓝图信息有限公司", "岗位薪资": "12-27Kx13薪", "岗位要求": "0-1年大专 211优先", "岗位职责": "参与系统设计与核心模块开发，使用SpringBoot, MySQL, TensorFlow, Go, Kubernetes, Kafka, React, JVM； 编写接口与技术文档，保证代码质量与稳定性； 优化性能与可靠性，参与上线与故障排查； 协作跨团队沟通，推进项目按期交付", "岗位地址": "北京东城区中心大道国际中心C座6层", "二级分类": "后端开发", "三级分类": "Java", "城市": "北京"}, "resume": {"personal_info": {"current_city": "上海", "willingness_to_relocate": true, "availability_date": "2024-08-01", "phone": "138-0013-8000", "email": "zhangwei.dev@email.com"}, "work_preferences": {"position_type_name": ["Java", "全栈工程师"], "salary_expectation": {"min_annual_package": 300000, "currency": "CNY"}, "industry_preferences": ["电子商务", "人工智能"]}, "professional_summary": {"total_experience_years": 3.5, "education_level": "本科", "school_level": 0, "graduation_year": 2021}, "full_resume_text": "张伟 | 求职意向: Java后端开发、全栈    基本信息:    - 现居地: 深圳市南山区    - 联系电话: 138-0013-8000    - 邮箱: zhangwei.dev@email.com    - 学历: 本科 (2017-2021)    - 工作经验: 3.5年    - 入职时间: 我目前在职，最早可以在2024年8月1号入职。    - 职业期望: 期望在电子商务或人工智能行业发展。对上海的工作机会也持开放态度。    - 期望薪资: 我的期望是年薪不低于30万人民币。    专业技能:    - 精通 Java 和golang语言，熟悉 JVM 原理和多线程编程。    - 熟练掌握 Spring Boot, Spring Cloud, MyBatis等主流微服务框架。    - 熟悉 MySQL, Redis, Kafka，并有相关的性能优化经验。    - 了解 Python 和 Go 语言，能够编写简单的脚本。    - 熟悉 Docker, Kubernetes 等容器化技术。    工作经历:    \"Java后端\": {        \"companies\": [\"阿里巴巴\", \"京东\", \"美团\", \"滴滴\", \"百度\"],        \"skills\": [\"Java\", \"SpringBoot\", \"SpringCloud\", \"MyBatis\", \"MySQL\", \"Redis\", \"Kafka\", \"微服务\", \"分布式系统\"],        \"responsibilities\": [            \"负责后端服务的设计和开发\",            \"使用SpringBoot构建微服务架构\",            \"参与系统性能优化和容量规划\",            \"处理高并发场景下的技术问题\",            \"编写技术文档和Code Review\"        ]    }", "skills": ["Java", "Golang", "JVM", "多线程编程", "Spring Boot", "Spring Cloud", "MyBatis", "MySQL", "Redis", "Kafka", "Python", "Go", "Docker", "Kubernetes", "微服务", "分布式系统"], "work_experience": {"companies": ["阿里巴巴", "京东", "美团", "滴滴", "百度"], "responsibilities": ["负责后端服务的设计和开发", "使用SpringBoot构建微服务架构", "参与系统性能优化和容量规划", "处理高并发场景下的技术问题", "编写技术文档和Code Review"]}}}
{"action": "skip", "job": {"岗位名称": "Java中级开发工程师", "企业": "光瀚科技有限公司", "岗位薪资": "22-32K·13薪", "岗位要求": "1-3年大专", "岗位职责": "参与系统设计与核心模块开发，使用Redis, PyTorch, TensorFlow, Java, Kafka, JVM； 编写接口与技术文档，保证代码质量与稳定性； 优化性能与可靠性，参与上线与故障排查； 协作跨团队沟通，推进项目按期交付", "岗位地址": "北京丰台区滨江大道人才大厦B座12层", "二级分类": "后端开发", "三级分类": "Java", "城市": "北京"}, "resume": {"personal_info": {"current_city": "上海", "willingness_to_relocate": true, "availability_date": "2024-08-01", "phone": "138-0013-8000", "email": "zhangwei.dev@email.com"}, "work_preferences": {"position_type_name": ["Java", "全栈工程师"], "salary_expectation": {"min_annual_package": 300000, "currency": "CNY"}, "industry_preferences": ["电子商务", "人工智能"]}, "professional_summary": {"total_experience_years": 3.5, "education_level": "本科", "school_level": 0, "graduation_year": 2021}, "full_resume_text": "张伟 | 求职意向: Java后端开发、全栈    基本信息:    - 现居地: 深圳市南山区    - 联系电话: 138-0013-8000    - 邮箱: zhangwei.dev@email.com    - 学历: 本科 (2017-2021)    - 工作经验: 3.5年    - 入职时间: 我目前在职，最早可以在2024年8月1号入职。    - 职业期望: 期望在电子商务或人工智能行业发展。对上海的工作机会也持开放态度。    - 期望薪资: 我的期望是年薪不低于30万人民币。    专业技能:    - 精通 Java 和golang语言，熟悉 JVM 原理和多线程编程。    - 熟练掌握 Spring Boot, Spring Cloud, MyBatis等主流微服务框架。    - 熟悉 MySQL, Redis, Kafka，并有相关的性能优化经验。    - 了解 Python 和 Go 语言，能够编写简单的脚本。    - 熟悉 Docker, Kubernetes 等容器化技术。    工作经历:    \"Java后端\": {        \"companies\": [\"阿里巴巴\", \"京东\", \"美团\", \"滴滴\", \"百度\"],        \"skills\": [\"Java\", \"SpringBoot\", \"SpringCloud\", \"MyBatis\", \"MySQL\", \"Redis\", \"Kafka\", \"微服务\", \"分布式系统\"],        \"responsibilities\": [            \"负责后端服务的设计和开发\",            \"使用SpringBoot构建微服务架构\",            \"参与系统性能优化和容量规划\",            \"处理高并发场景下的技术问题\",            \"编写技术文档和Code Review\"        ]    }", "skills": ["Java", "Golang", "JVM", "多线程编程", "Spring Boot", "Spring Cloud", "MyBatis", "MySQL", "Redis", "Kafka", "Python", "Go", "Docker", "Kubernetes", "微服务", "分布式系统"], "work_experience": {"companies": ["阿里巴巴", "京东", "美团", "滴滴", "百度"], "responsibilities": ["负责后端服务的设计和开发", "使用SpringBoot构建微服务架构", "参与系统性能优化和容量规划", "处理高并发场景下的技术问题", "编写技术文档和Code Review"]}}}
{"action": "skip", "job": {"岗位名称": "Java初级开发工程师", "企业": "极光智能有限公司", "岗位薪资": "28-43Kx13薪", "岗位要求": "0-1年本科", "岗位职责": "参与系统设计与核心模块开发，使用Redis, Java, SpringBoot, 多线程, Docker, Vue； 编写接口与技术文档，保证代码质量与稳定性； 优化性能与可靠性，参与上线与故障排查； 协作跨团队沟通，推进项目按期交付", "岗位地址": "南京鼓楼区云谷路产业园A座C座6层", "二级分类": "后端开发", "三级分类": "Java", "城市": "南京"}, "resume": {"personal_info": {"current_city": "深圳", "willingness_to_relocate": true, "availability_date": "2024-08-01", "phone": "138-0013-8000", "email": "zhangwei.dev@email.com", "education": {"degree": "本科", "graduation_year": 2021}}, "work_preferences": {"position_type_name": ["Java", "全栈工程师", "其他后端开发"], "salary_expectation": {"min_annual_package": 300000, "currency": "CNY"}, "industry_preferences": ["电子商务", "人工智能"]}, "professional_summary": {"total_experience_years": 3.5, "education_level": "本科", "school_level": 0}, "full_resume_text": "张伟 | 求职意向: Java后端开发、全栈    基本信息:    - 现居地: 深圳市南山区    - 联系电话: 138-0013-8000    - 邮箱: zhangwei.dev@email.com    - 学历: 本科 (2017-2021)    - 工作经验: 3.5年    - 入职时间: 我目前在职，最早可以在2024年8月1号入职。    - 职业期望: 期望在电子商务或人工智能行业发展。对上海的工作机会也持开放态度。    - 期望薪资: 我的期望是年薪不低于30万人民币。    专业技能:    - 精通 Java 和golang语言，熟悉 JVM 原理和多线程编程。    - 熟练掌握 Spring Boot, Spring Cloud, MyBatis等主流微服务框架。    - 熟悉 MySQL, Redis, Kafka，并有相关的性能优化经验。    - 了解 Python 和 Go 语言，能够编写简单的脚本。    - 熟悉 Docker, Kubernetes 等容器化技术。    工作经历:    \"Java后端\": {        \"companies\": [\"阿里巴巴\", \"京东\", \"美团\", \"滴滴\", \"百度\"],        \"skills\": [\"Java\", \"SpringBoot\", \"SpringCloud\", \"MyBatis\", \"MySQL\", \"Redis\", \"Kafka\", \"微服务\", \"分布式系统\"],        \"responsibilities\": [            \"负责后端服务的设计和开发\",            \"使用SpringBoot构建微服务架构\",            \"参与系统性能优化和容量规划\",            \"处理高并发场景下的技术问题\",            \"编写技术文档和Code Review\"        ]    }", "skills": {"programming_languages": ["Java", "Golang", "Python"], "frameworks": ["Spring Boot", "Spring Cloud", "MyBatis"], "databases": ["MySQL", "Redis"], "tools": ["Kafka", "Docker", "Kubernetes"], "concepts": ["微服务", "分布式系统", "JVM原理", "多线程编程", "性能优化"]}, "work_experience": [{"role": "Java后端", "companies": ["阿里巴巴", "京东", "美团", "滴滴", "百度"], "skills": ["Java", "SpringBoot", "SpringCloud", "MyBatis", "MySQL", "Redis", "Kafka", "微服务", "分布式系统"], "responsibilities": ["负责后端服务的设计和开发", "使用SpringBoot构建微服务架构", "参与系统性能优化和容量规划", "处理高并发场景下的技术问题", "编写技术文档和Code Review"]}]}}
{"action": "like", "job": {"岗位名称": "Java中级开发工程师", "企业": "光瀚科技有限公司", "岗位薪资": "22-32K·13薪", "岗位要求": "1-3年大专", "岗位职责": "参与系统设计与核心模块开发，使用Redis, PyTorch, TensorFlow, Java, Kafka, JVM； 编写接口与技术文档，保证代码质量与稳定性； 优化性能与可靠性，参与上线与故障排查； 协作跨团队沟通，推进项目按期交付", "岗位地址": "北京丰台区滨江大道人才大厦B座12层", "二级分类": "后端开发", "三级分类": "Java", "城市": "北京"}, "resume": {"personal_info": {"current_city": "深圳", "willingness_to_relocate": true, "availability_date": "2024-08-01", "phone": "138-0013-8000", "email": "zhangwei.dev@email.com", "education": {"degree": "本科", "graduation_year": 2021}}, "work_preferences": {"position_type_name": ["Java", "全栈工程师", "其他后端开发"], "salary_expectation": {"min_annual_package": 300000, "currency": "CNY"}, "industry_preferences": ["电子商务", "人工智能"]}, "professional_summary": {"total_experience_years": 3.5, "education_level": "本科", "school_level": 0}, "full_resume_text": "张伟 | 求职意向: Java后端开发、全栈    基本信息:    - 现居地: 深圳市南山区    - 联系电话: 138-0013-8000    - 邮箱: zhangwei.dev@email.com    - 学历: 本科 (2017-2021)    - 工作经验: 3.5年    - 入职时间: 我目前在职，最早可以在2024年8月1号入职。    - 职业期望: 期望在电子商务或人工智能行业发展。对上海的工作机会也持开放态度。    - 期望薪资: 我的期望是年薪不低于30万人民币。    专业技能:    - 精通 Java 和golang语言，熟悉 JVM 原理和多线程编程。    - 熟练掌握 Spring Boot, Spring Cloud, MyBatis等主流微服务框架。    - 熟悉 MySQL, Redis, Kafka，并有相关的性能优化经验。    - 了解 Python 和 Go 语言，能够编写简单的脚本。    - 熟悉 Docker, Kubernetes 等容器化技术。    工作经历:    \"Java后端\": {        \"companies\": [\"阿里巴巴\", \"京东\", \"美团\", \"滴滴\", \"百度\"],        \"skills\": [\"Java\", \"SpringBoot\", \"SpringCloud\", \"MyBatis\", \"MySQL\", \"Redis\", \"Kafka\", \"微服务\", \"分布式系统\"],        \"responsibilities\": [            \"负责后端服务的设计和开发\",            \"使用SpringBoot构建微服务架构\",            \"参与系统性能优化和容量规划\",            \"处理高并发场景下的技术问题\",            \"编写技术文档和Code Review\"        ]    }", "skills": {"programming_languages": ["Java", "Golang", "Python"], "frameworks": ["Spring Boot", "Spring Cloud", "MyBatis"], "databases": ["MySQL", "Redis"], "tools": ["Kafka", "Docker", "Kubernetes"], "concepts": ["微服务", "分布式系统", "JVM原理", "多线程编程", "性能优化"]}, "work_experience": [{"role": "Java后端", "companies": ["阿里巴巴", "京东", "美团", "滴滴", "百度"], "skills": ["Java", "SpringBoot", "SpringCloud", "MyBatis", "MySQL", "Redis", "Kafka", "微服务", "分布式系统"], "responsibilities": ["负责后端服务的设计和开发", "使用SpringBoot构建微服务架构", "参与系统性能优化和容量规划", "处理高并发场景下的技术问题", "编写技术文档和Code Review"]}]}}
